,name,time,brand,post,date,car name,location,posted,thanked
7, lrsays , 16:34 ,BHPian," Quote: Originally Posted by rahul_goyal Infotainment and MID 8 inch infotainment unit comes with Arkamys premium sound mood and lets you connect to more than one phone at a time (I tested with two phones). Only one phone at a time can be connected for making/receiving calls over bluetooth. Sound output is good and an average user will not complain. Android Auto and Apple car play is supported as well. Reverse camera turns on automatically when the car is shifted to R and gives wide view of the space/things at the rear. Seat fabric quality is good but the grey colour is prone to get soiled. I will go with dry cleaning in future and haven't planned to install any seat covers as of now. Congrats for new car and thanks for detailed review and images, from the image you uploaded it looks like Hyundai changed arrangement of knobs on head unit. Grand i10 had volume up/down and track next/prev on steering and closer to steering they had given volume up/down (on head unit), that was annoying as for power on/off you have to go to extreme left dial. Any knob/switch or dial which doesn't have steering mounted control (but available only on head unit) should have been closer to driver. Someone realized this mistake and shifted power on/off to the right and moved volume dial to left side.", 27th September 2019,hyundai-grand-i10,BANGALROE,36,26
8, Durango Dude , 16:40 ,Senior - BHPian,"Congrats, Rahul, on your Titan Grey NIOS AMT. Looks super like a ""Urus"" head on. Love how the body color compliments the interior theme. Very useful write up and images. Yeah, I've also got Dr Charcoal in my car! Happy motoring to you! Yours must be the first NIOS AMT ownership review thread in TBHP. It will be useful for others who may be interested in the NIOS. Keep the thread updated.", 27th September 2019,hyundai-grand-i10,Chennai,"1,935","5,084"
9, peterjim13 , 16:46 ,BHPian,I really loved the overall looks of the car and the alloy wheel is quite complimenting. But all through the ad's where a blue shade of the car - but this colour looks the best so far for me. Decent paint job btw - and loved the black treatment across the grille etc. Great choice and all the best, 27th September 2019,hyundai-grand-i10,Kochi/S.Bathery,670,647
10, praveen_v , 16:46 ,BHPian,Congratulations on the new car. I am also looking at a Nios AMT and the same color as well and the experience from a user perspective is really helpful for someone like me looking to take the plunge. I am looking to move from a Jazz CVT to the Nios AMT (Due to various reasons) and was worried a bit regarding the AT experience and the efficiency. I drive with a light foot and based on your experience and my test drive I think i should be able to adapt quickly without feeling like a too much of a downgrade. Hyundai's AMT is based on electric actuators (Quicker and smoother?) compared to hydraulic actuators in other AMT boxes and as per tbhp review of Hyundai's AMT it seems to be the best implementation as far as AMTs are concerned. FE also seems to be on par with the Jazz CVT under city condition. I feel that the interior space is almost at par with the Jazz and the rear bench has more depth and comfortable with ample leg room. The boot is much smaller though and expected due to its dimensions. Hyundai has again short-changed by not giving the AMT option on the top end but at least they have not skimped too much in the sportz variant compared to other models in Hyundai lineup. Do keep updating the mods/accessories when you add and again wishing you a great time with the car., 27th September 2019,hyundai-grand-i10,Chennai,505,206
11, forester , 16:55 ,BHPian,"Many congratulations on a lovely looking car there and a tasteful choice of colour. Wish you many miles of blissful ownership! According to this report - https://www.autocarpro.in/news-natio...says-iza-44162 - it's alarming how carmakers in India cut corners and skimp on the basic galvanisation (anti-corrosion) process for their domestic models to save costs. The report also suggests that with increasing use of High Strength Steel, it is even more important to galvanise the BIW to avoid rusting of this comparatively thinner sheet metal. Now, if Hyundai hasn't gone ahead and treated the NIOS, whose body is comprised of 65% Advanced and High SS, you are better off getting it coated from a reputable service provider. Should keep the hassle away from a long-term ownership perspective ", 27th September 2019,hyundai-grand-i10,New,116,640
12, Dieselritzer , 18:33 ,BHPian, Quote: Originally Posted by praveen_v I feel that the interior space is almost at par with the Jazz and the rear bench has more depth and comfortable with ample leg room. The boot is much smaller though and expected due to its dimensions. . The interior space is significantly less than Jazz. The rear bench is a strict 2 seater + 1 kid. Jazz has wider seats. Boot space is also way lesser than what Jazz offers., 27th September 2019,hyundai-grand-i10,Mumbai,582,"1,410"
13, spanner777 , 19:15 ,BHPian,"Congrats on the new car. It indeed looks amazing in those gun metal alloys. Quote: Creeping Function Quote: The Creeping function helps the vehicle to start smoothly. If you take your foot off the brake pedal when the shift lever is either in R (Reverse), D (Drive) or M (Manual) position, the vehicle will start slowly without depressing the accelerator pedal. To disable the function, depress the brake pedal or pull up the parking brake lever. The creeping function will not operate when the parking brake lever is engaged with the shift lever in R (Reverse), D (Drive) or M (Manual) position. Please tell me how usable is the creep function in steep inclines. Is it predictable?", 27th September 2019,hyundai-grand-i10,Cochin,38,48
14, VWAllstar , 19:20 ,BHPian," Quote: Originally Posted by Dieselritzer The interior space is significantly less than Jazz. The rear bench is a strict 2 seater + 1 kid. Jazz has wider seats. Boot space is also way lesser than what Jazz offers. Jazz is a premium hatchback which should be compared to Hyundai's Elite I20. Nios is a direct competition to Swift. Let aside the space, why such a (un)fair treatment with the seat fabrics? Will get spoiled in no time.", 27th September 2019,hyundai-grand-i10,Mumbai,950,"2,435"
15, abhinav.s , 21:48 ,Senior - BHPian," Quote: Originally Posted by rahul_goyal While I am keen on ceramic coating, I have mixed feeling about anti rust coating. I have gone through the forum, but didn't quite make up my mind on the necessity of going for antirust coat. I read that it's not required in Delhi NCR. Say if the underbody does get rusted, isn't that covered in your warranty? Congrats on the new car. Looks awesome in the chosen color along with the superb looking alloys. Wishing you many many happy miles with the car. Ceramic coating is probably an overkill on a new car. A basic paint sealant treatment should be sufficient. You could probably do the ceramic coating after a year or two when you feel like doing something for the car to make it look fresh. For anti-rust coating, read your owners manual. Some mfg. clearly mention the duration for which warranty is applicable for rusting. Example: VW states clearly for Polo, Vento, Ameo it is 6 years anti-rust warranty while for Jetta, Passat and Tiguan it is 12 years. Something similar should be mentioned in the owners manual of the Nios too. One thing I have noticed is that due to the thinner sheet metal on Maruti cars, going for the anti-rust protection from 3M for the underbody helps reduce the road noise to a good extent. If not for anything else, you can get it done for this benefit. ", 27th September 2019,hyundai-grand-i10,Bangalore,"2,769","1,266"
16, dark.knight , 22:28 ,Distinguished - BHPian,"I don't normally say this for hatchbacks, as most manufacturers make rather plain-jane cars under the 10L price barrier but this has got to be the most stimulating hatchback I've ever seen, my god that front grille and headlamp, I'd mistake it for a D-Segment sedan if not for the narrower proportions. As usual they've cut corners too, they remove backlit power-window buttons usually but here they power window button isn't even having the window logo on them, looks like a homage to cars under the 5L barrier, and then the steering wheel control buttons, as a fan of omnibalance designs this looks out of place as far as my car OCD is concerned. Also, no harm in giving adjustable headrests. Congrats, as far as small and efficient is concerned, this takes the cake.. a perfect city oriented, family car with better F.E than torque converters. They have simply whacked it out of the park when it comes to design. I don't think you need to waste money on ceramic coating, just get it washed well and maintained well, save the money for other stuff. Noodle mats are another unnecessary item that cost 3-4 times more than they are supposed to cost. Just get a complete professional wash+vacuum+wax done every 3 months or so.", 27th September 2019,hyundai-grand-i10,Beans,"1,847","8,351"
17, rahul_goyal , 23:19 ,BHPian," Quote: Originally Posted by spanner777 Congrats on the new car. It indeed looks amazing in those gun metal alloys. Please tell me how usable is the creep function in steep inclines. Is it predictable? Thank you! Creep function takes about a split second to react and starts to move in a very relaxed manner. So do not expect hill hold functionality from creep function. In stop-go traffic on an incline, I always use handbrake to prevent the car from crawling back and I believe this is recommended even for automatics as it reduces pressure on the clutch.", 27th September 2019,hyundai-grand-i10,Gurugram,138,857
18, VWAllstar , 23:35 ,BHPian," Quote: Originally Posted by Durango Dude Yeah, I've also got Dr Charcoal in my car! Even I have one in my car. But do you guys really feel the difference? To be honest I haven't felt any noticable difference inside the car. I try to keep it on the dashboard when there is sunshine so it gets activated and does not remain moist because of the incessant rains of Mumbai.", 27th September 2019,hyundai-grand-i10,Mumbai,950,"2,435"
19, rahul_goyal , 23:52 ,BHPian," Quote: Originally Posted by VWAllstar Even I have one in my car. But do you guys really feel the difference? To be honest I haven't felt any noticable difference inside the car. I try to keep it on the dashboard when there is sunshine so it gets activated and does not remain moist because of the incessant rains of Mumbai. I'll be honest, I bought it thinking that it will have some fragrance (I didn't read the description while ordering) . But now having read the description, I understand its an air purifier that removes odor, pollutants, excess moisture and allergens. There's no real way to know how well it works on a new car. May be someone who has odor and moisture problem in their car can confirm if this is found effective.", 27th September 2019,hyundai-grand-i10,Gurugram,138,857
20, adi.mariner , 06:23 ,BHPian,"Congratulations rahul_goyal for your new Grand i10 Nios. It looks really spectacular in the Grey shade with the Gun metal finish alloys. Wish you a very happy ownership experience. The variable extended warranty is a good addition with the car for those whose usage is not a lot. You have mentioned the On-Road pricing to be around 8 lakhs. When I checked the On-road pricing for Pune on Carwale, the website shows it to be 9.41 Lakhs. Was it some introductory pricing that you got while booking the car? Picture credits - www.carwale.com", 28th September 2019,hyundai-grand-i10,Pune,516,"1,265"
21, Durango Dude , 07:06 ,Senior - BHPian," Quote: Originally Posted by VWAllstar Even I have one in my car. But do you guys really feel the difference? To be honest I haven't felt any noticable difference inside the car. I try to keep it on the dashboard when there is sunshine so it gets activated and does not remain moist because of the incessant rains of Mumbai. Haven't noticed, haven't put it out in the sun, even once. I bought a lot of Charcoal to prevent moisture creating problems in the car, wardrobe and also to avoid bad odor. But the catch of sunning it once a month is a chore!", 28th September 2019,hyundai-grand-i10,Chennai,"1,935","5,084"
22, rahul_goyal , 07:39 ,BHPian," Quote: Originally Posted by adi.mariner You have mentioned the On-Road pricing to be around 8 lakhs. When I checked the On-road pricing for Pune on Carwale, the website shows it to be 9.41 Lakhs. Was it some introductory pricing that you got while booking the car? Picture credits - www.carwale.com Thank you! The screenshot provided is for CRDI (diesel) Sportz AMT variant, mine is a petrol. Price break up is provided in the original post. No special discount or introductory price was available on Nios.", 28th September 2019,hyundai-grand-i10,Gurugram,138,857
23, adi.mariner , 08:04 ,BHPian," Quote: Originally Posted by rahul_goyal Thank you! The screenshot provided is for CRDI (diesel) Sportz AMT variant, mine is a petrol. Didn't realise that at all. My mistake. Thank you for pointing out. Note to mods : Can you please delete my previous post if possible. Thank you.", 28th September 2019,hyundai-grand-i10,Pune,516,"1,265"
24, VWAllstar , 08:20 ,BHPian,"I am so highly impressed with the interior design, fit, finish,quality and colour of this car. Even the exterior colours given by Hyundai are growing on me. If not this then nothing can beat the ubiquitous Swift in India. Hyundai may have overpriced the car a bit but it is a BS6 version so if Swift moves on to the same stage, both shall be equally priced. I am not a Hyundai fan at all but perspectives are changing. Especially with designs and features, Hyundai is much better than any other brand in the country now. (Subjective) Things I don't like about them: Brakes - They have a weird hardness to them. Does not inspire confidence. Handling: Poor driving dynamics and light steering. Although post 60 kmph, it weighs in well. ( Is there something one can do to make it better like Fiats or VWs?) Been told a few negatives about them by my Solution Architect who owned the i20. 1. Post 3-4 years Hyundai cars are expensive to maintain 2. There are a lot of electronic (features) which post few years need replacement and are very expensive 3. The paint quality of Hyundai is not very good 4. Service costs of Hyundai are on the expensive side but no one talks about it I have never owned a Hyundai before, but this Nios is quite tempting to be the go to car for city drives. Loved the aesthetics and materials, well done Hyundai India ", 28th September 2019,hyundai-grand-i10,Mumbai,950,"2,435"
25, Romeo_Mike , 14:02 ,BHPian,"Congratulations on your new car! That's one smart looking car. I am especially a fan of the front end - reminds me of ferrari curves. Regarding the anti-rust coating.. I think the cars already have enough corrosion protection on the exposed surfaces out of the factory. I was very enthusiastic about it when I got my car, especially because of the prolonged monsoons in mumbai. But never went back after getting it done at 3M once in the beginning. Didn't really see any difference.", 28th September 2019,hyundai-grand-i10,MH04,181,560
26, Nazaar25 , 19:30 ,BHPian,"Congratulations on this beautiful machine! As a Dzire AMT owner, I assure you that the shifts will get faster and smoother with time. Lifting off the accelerater before the gear shift at higher RPMs will prevent the head nod/jerk. Again wishing you lakhs of trouble free and happy miles with the Nios!", 28th September 2019,hyundai-grand-i10,Mumbai,202,467
27, zehhatter , 00:17 ,Newbie,"Congratulations !!! The color looks great,i had taken the petrol Asta for a test drive and was very much impressed with it. It's a great fun car for the city commute. I had a difficult time deciding on the color but your images have convinced me to go for this shade. Hyundai has a terrible habit of skipping automatics for top end and subtracting few inexpensive but important features like rear wiper and leather wrapped steering on the sportz. Its a pain to use a bare rubber steering if your car is lying baked in the sun for a long time, it also gets sticky after use and its one of the things where you can't get a proper fitting done in the aftermarket. Regarding the activated charcoal,it works to a certain extent in getting rid of smoke smells, i can't comment on other smells though.", 29th September 2019,hyundai-grand-i10,bhubaneswar,19,65
28, roadrunner_nv , 08:35 ,BHPian,"The car color, finish and lines make it look a couple of lakhs more expensive. I’ve always liked clean cars and ceramic is good no doubt. What might be better? Paint protection film; applied correctly, it might give you better protection against swirl marks than a conventional ceramic coat. Coming back to the car, it looks fantastic and having experienced Hyundai’s refinement levels, I’m sure it’s going to keep a smile plastered for a long time!", 29th September 2019,hyundai-grand-i10,Pune,176,628
29, kutts , 16:40 ,BHPian,Congrats on the new car. My dad has also booked the Sportz AMT. The car should be delivered this week. I was negotiating the deal and found Hyundai to be quite unflexible especially given current market conditions. The ex showroom price is 7.07lk. I managed to squeeze out a 5k discount and then switched to an outside insurance much to the discomfort of the dealer . Not sure what the Hyundai standard offer for insurance costing 42k is for. I am planning to get Oriental insurance 3+3 Zero depreciation for 36k. The 3+1 Zero depreciation quote is 22k. The 1% reduction in tax has not yet trickled in, 29th September 2019,hyundai-grand-i10,Trivandrum,247,399
30, Ricky_63 , 18:14 ,Senior - BHPian,"Congratulations on your new car !! Looks great When I bought my Creta, I was ""forced"" into getting anti-rust coating on the undercarriage, it is a total waste on a new car. Specially in Delhi-NCR kind of weather. So best to stay away from it ! Your insurance seems to be on the higher side. Hope you checked from outside before buying, as the insurance from the dealer is always more expensive by almost 25-30% Enjoy the car ! Cheers", 29th September 2019,hyundai-grand-i10,Gurgaon,"3,885",518
31, rahul_goyal , 19:24 ,BHPian," Quote: Originally Posted by kutts Congrats on the new car. My dad has also booked the Sportz AMT. The car should be delivered this week. I was negotiating the deal and found Hyundai to be quite unflexible especially given current market conditions. The ex showroom price is 7.07lk. I managed to squeeze out a 5k discount and then switched to an outside insurance much to the discomfort of the dealer . Not sure what the Hyundai standard offer for insurance costing 42k is for. I am planning to get Oriental insurance 3+3 Zero depreciation for 36k. The 3+1 Zero depreciation quote is 22k. The 1% reduction in tax has not yet trickled in Thank you.! Check for couple of things before buying insurance: 1. Whether cashless claim facility is provided? 2. Insurance company is on panel of Hyundai workshops? Quite surprising to know that you got 5k discount on Nios. All the Hyundai I spoke to, specifically told me that there is no discount on Nios and Venue. All the best with your purchase. ", 29th September 2019,hyundai-grand-i10,Gurugram,138,857
32, kutts , 20:35 ,BHPian,Spot on. It's not cashless so I expect huge delays in case of a claim. It was pretty much arm twisting to get the deal. Two other dealers never even returned calls. This dealer is going to get my brownie points while referring any friends who plan to buy a Hyundai. , 29th September 2019,hyundai-grand-i10,Trivandrum,247,399
33, rahul_goyal , 22:23 ,BHPian," Quote: Originally Posted by Ricky_63 Congratulations on your new car !! Looks great When I bought my Creta, I was ""forced"" into getting anti-rust coating on the undercarriage, it is a total waste on a new car. Specially in Delhi-NCR kind of weather. So best to stay away from it ! Your insurance seems to be on the higher side. Hope you checked from outside before buying, as the insurance from the dealer is always more expensive by almost 25-30% Dealer originally quoted INR 38150/- for zero depreciation policy. I checked it from outside and got a quote for about 30k. Informed the dealer that I'll be taking it from outside. They came up with a similar quote, so I bought it from them. I have following add on covers: 1. Zero depreciation 2. Engine protection 3. Consumables 4. Personal belongings 5. Key protection", 29th September 2019,hyundai-grand-i10,Gurugram,138,857
34, vivee90 , 15:43 ,BHPian,"A very nice review. Happy that Hyundai has added some features that were missed in the previous Gen like the automatic door lock and Fuel consumption details in MID. The car looks stunning especially the side profile. AMT with 5 speeds is a big aspect and makes a huge step-up from the previous gen. Happy driving! The older Gi10 has underbody rust protection from factory, So, I don't think it is required but for the exhaust. Do check before you go for it.", 30th September 2019,hyundai-grand-i10,Nagpur,128,505
35, rahul_goyal , 14:49 ,BHPian," Quote: Originally Posted by lrsays Congrats for new car and thanks for detailed review and images, from the image you uploaded it looks like Hyundai changed arrangement of knobs on head unit. Quote: Someone realized this mistake and shifted power on/off to the right and moved volume dial to left side. Power on/off and volume is controlled by the knob on the right. (No changes there) Left knob is for tuning FM stations. Refer to image. Link", 1st October 2019,hyundai-grand-i10,Gurugram,138,857
36, rahul_goyal , 19:23 ,BHPian,"Update 1 After few hours of this review going live, I got a call from the SA and he told me that they have received an email from Hyundai regarding the negative feedback received on Team-BHP against Himgiri. However, his main concern was pre-delivery inspection photo of the car, that I have added in the first post. He said that the car had dirt marks on the doors and that didn't go down well with Hyundai team. I told him that in my review, I have specifically mentioned that the picture was taken on pre-delivery inspection. I also told him that at the time of delivery, I wasn't happy with the cleanliness of the car from inside and the same is mentioned in the review itself. His other concern was the feedback on lack of variable warranty information, but then he explained himself by saying that its justified as the car is new and SAs were not trained. Couple of days later, I visited the showroom for getting the HSRP installed and to replace the rubber mats with official Nios carpet mats. They also gave me the service book cover. Himgiri team asked me to sign a form which stated that I had some concerns with the showroom, but the same has now been rectified to my satisfaction. I politely declined to sign any form as I stand by my concerns and feedback posted in my review. The car has completed approx 1200 kms and is due for its first service. I plan to get the service done this Saturday and will share an update. Some pictures of the mats and door guard I just installed are attached below. Official Nios carpet mats (The hook on the floor perfectly fits the mat on driver's side mat) Purchased these noodle mats from Hindustan Car Accessories at Sikanderpur for INR 1000/- (5 independent mats; they appear to be of good quality and should last for at least couple of years) Installed the door guards (bought from Amazon) Up-close view of door guard ", 8th October 2019,hyundai-grand-i10,Gurugram,138,857
37, praveen_v , 23:35 ,BHPian," Quote: Originally Posted by rahul_goyal Update 1 After few hours of this review going live, I got a call from the SA and he told me that they have received an email from Hyundai regarding the negative feedback received on Team-BHP against Himgiri. Wow! So Hyundai team is watching here for user feedback and your thread has gotten the right attention. I think I also read about some bad experience with this dealership in the Venue thread. Hope hyundai also gets a clear message from the forum about some of their bad variant feature distribution like missing rear wipers on lower variants, no top end AT etc. Did you get any official accessories list from the dealership for nios? When i enquired in the dealership here they said they don't have it yet even almost 2 months after launch.", 8th October 2019,hyundai-grand-i10,Chennai,505,206
38, SoumenD , 10:19 ,Senior - BHPian,"Congratulations on the purchase. Looks great in this color with gun metal alloys. Grand i10 is a great car for city usage and the only issue I had with previous AT model was the dismal FE & lack of basic features like rear wash/wipe. FE issue seems to have been taken care of in this iteration, specially considering both previous grand i10 AT & i20 CVT are notorious of being guzzlers. Those numbers (11.5-12.5kmpl) for petrol hyundai automatic(although AMT) are on par/slightly better than my Jazz CVT in bangalore. Quote: Originally Posted by rahul_goyal Update 1 After few hours of this review going live, I got a call from the SA and he told me that they have received an email from Hyundai regarding the negative feedback received on Team-BHP against Himgiri. Good to see Hyundai is following team-bhp feedback. Quote: Originally Posted by praveen_v I feel that the interior space is almost at par with the Jazz Wow now that's news to me. That would mean the Nios is more spacious than i20 & Venue at the rear? During my search(6 months back) one of the reasons for going for Jazz over i20 was the rear space which is better than compact-sedans & some subcompact-SUVs as well.", 9th October 2019,hyundai-grand-i10,India,"1,747","6,274"
